{
  "schema_version": "1.0",
  "scene_id": "S01",
  "assumptions": [
    "Foreground, midground, and background details not established by the source scene or shot list remain unspecified.",
    "Delivery aspect ratio is unconfirmed."
  ],
  "storyboard_intent": "Make Ninel's learned breath, uncertain reflection, and turn toward the revealed planet readable while preserving the reflection's ambiguity.",
  "panels": [
    {
      "panel_id": "S01-SB001",
      "shot_id": "S01-SH001",
      "moment": "At countdown seven, Ninel's open eye observes frost move as she begins her first dry inhale.",
      "framing": "Extreme close-up through chamber glass.",
      "camera_height": "At Ninel's eye line behind the chamber glass.",
      "angle": "Eye-level through chamber glass.",
      "foreground": "Condensation and frost on the chamber glass.",
      "midground": "Ninel's eye, slightly below frame center.",
      "background": "Unresolved darkness inside the chamber.",
      "subject_placement": "Ninel's eye sits slightly below center with the diagnostic reflection crossing the glass.",
      "action_direction": "Frost disturbance travels across the glass toward frame right.",
      "movement_state": "Her voluntary inhale begins and the camera begins its slow dolly out.",
      "lighting_note": "Emergency pulse and cold diagnostic source retain eye and glass detail.",
      "audio_cue": "The diagnostic countdown reaches seven with chamber vibration and Ninel's first dry inhale.",
      "continuity_note": "Preserve the frost pattern and eye line for the later wider angle.",
      "dramatic_purpose": "Present life as a learned action rather than an automatic fact."
    },
    {
      "panel_id": "S01-SB002",
      "shot_id": "S01-SH002",
      "moment": "Ninel has turned away while the monitor reflection appears to continue looking at her.",
      "framing": "Medium shot.",
      "camera_height": "Slightly below Ninel's seated eye line.",
      "angle": "Slightly low eye-line neutral angle.",
      "foreground": "The chamber edge and Ninel's planted right hand.",
      "midground": "Ninel seated and half-turned away from the monitor.",
      "background": "The monitor occupies a dark secondary plane at frame right.",
      "subject_placement": "Ninel is held in controlled central geometry; the monitor remains background-right.",
      "action_direction": "Ninel turns toward frame left while the reflected turn appears delayed.",
      "movement_state": "The dolly-out is complete and camera holds; her turn pauses at the test state.",
      "lighting_note": "Existing chamber and emergency sources keep the monitor near-black without an anomaly cue.",
      "audio_cue": "Chamber release and low hum settle into a restrained quiet hold.",
      "continuity_note": "Keep the right hand on the chamber edge and preserve head angle for the monitor insert.",
      "dramatic_purpose": "Let the anomaly occur inside one credible spatial relationship."
    },
    {
      "panel_id": "S01-SB003",
      "shot_id": "S01-SH003",
      "moment": "The black monitor reflection appears to delay immediately before the monitor clears.",
      "framing": "Insert of the monitor surface.",
      "camera_height": "At Ninel's seated eye height.",
      "angle": "Level to the monitor surface.",
      "foreground": "The controlled near-black monitor surface.",
      "midground": "The disputed reflection occupies frame center.",
      "background": "Real Ninel is present only as edge spill.",
      "subject_placement": "The reflection is centered while real Ninel remains at the frame edge.",
      "action_direction": "The reflected turn lags toward frame left before the surface clears.",
      "movement_state": "Camera is static; the delayed reflection is about to disappear.",
      "lighting_note": "The monitor receives only the established room-reflection state.",
      "audio_cue": "The ship hum thins slightly with no sting.",
      "continuity_note": "Match Ninel's head angle from S01-SH002 and preserve the anomaly's uncertainty.",
      "dramatic_purpose": "Offer evidence without confirming whether it is objective."
    },
    {
      "panel_id": "S01-SB004",
      "shot_id": "S01-SH004",
      "moment": "The planet reaches its mark behind Ninel before Argo says failure.",
      "framing": "Medium-close single ending with Ninel and the slit.",
      "camera_height": "At Ninel's eye line.",
      "angle": "Eye-level three-quarter arc.",
      "foreground": "Ninel's near shoulder anchors the old space.",
      "midground": "Ninel faces the planet after following the changing light.",
      "background": "The blue-green planet appears through the slit behind her shoulder.",
      "subject_placement": "Ninel remains the dominant subject with the planet contained behind her.",
      "action_direction": "Ninel and camera turn toward frame right as the planet enters behind her.",
      "movement_state": "The synchronized slow arc settles after the visible axis reorientation.",
      "lighting_note": "Planet light grows only during Argo's pause while emergency light remains subordinate.",
      "audio_cue": "Ninel asks; a pause and structural groan precede Argo's answer.",
      "continuity_note": "Show the axis reorientation and place the planet before the word failure.",
      "dramatic_purpose": "Turn withheld personal history into an external scale of danger."
    }
  ]
}
