{
  "schema_version": "1.0",
  "scene_id": "NINEL-E02-SC001",
  "assumptions": [
    "The panel is a textual drawing instruction."
  ],
  "storyboard_intent": "Make the chosen breath and space reveal drawable.",
  "panels": [
    {
      "panel_id": "NINEL-E02-SC001-SB001",
      "shot_id": "NINEL-E02-SC001-SH001",
      "moment": "Ninel begins the first inhale.",
      "framing": "Medium single inherited from the shot list.",
      "camera_height": "At Ninel's eye line.",
      "angle": "Level through chamber geometry.",
      "foreground": "Chamber glass and frost.",
      "midground": "Ninel's eye and face.",
      "background": "Unresolved medical-bay darkness.",
      "subject_placement": "Ninel remains centered in the machine geometry.",
      "action_direction": "Frost moves across the glass as she rises.",
      "movement_state": "Camera begins the approved dolly out.",
      "lighting_note": "Cold chamber light retains glass detail.",
      "audio_cue": "The first inhale interrupts the room hum.",
      "continuity_note": "Match frost and eye line into the wider state.",
      "dramatic_purpose": "Make chosen agency visible."
    },
    {
      "panel_id": "NINEL-E02-SC001-SB002",
      "shot_id": "NINEL-E02-SC001-SH002",
      "moment": "Ninel begins the first inhale.",
      "framing": "Medium single inherited from the shot list.",
      "camera_height": "At Ninel's eye line.",
      "angle": "Level through chamber geometry.",
      "foreground": "Chamber glass and frost.",
      "midground": "Ninel's eye and face.",
      "background": "Unresolved medical-bay darkness.",
      "subject_placement": "Ninel remains centered in the machine geometry.",
      "action_direction": "Frost moves across the glass as she rises.",
      "movement_state": "Camera begins the approved dolly out.",
      "lighting_note": "Cold chamber light retains glass detail.",
      "audio_cue": "The first inhale interrupts the room hum.",
      "continuity_note": "Match frost and eye line into the wider state.",
      "dramatic_purpose": "Make chosen agency visible."
    }
  ]
}
